{
  "version": 2,
  "id": "SDK-US-017",
  "goals": [
    "SDK-US-017"
  ],
  "name": "failure-drain",
  "execution": {
    "mode": "offline-only",
    "reason": "requires controlled protocol/storage evidence; ordinary model text cannot establish this branch"
  },
  "setup": {
    "files": {
      "numbers.txt": "7\n11\n"
    }
  },
  "inputs": {},
  "steps": [],
  "expect": {
    "requests": [],
    "missingEvidence": "untriggered",
    "scope": "离线检查失败后已接收事件的排空。",
    "caseId": "SDK-US-017/failure-drain",
    "outOfScope": [
      "所有进程故障",
      "真实 provider 故障"
    ]
  },
  "limits": {
    "inputs": 0,
    "activitySeconds": 110,
    "transportSeconds": 120,
    "protocolBytes": 2097152,
    "stderrBytes": 262144
  }
}
