{
  "version": 2,
  "id": "SDK-US-001",
  "goals": [
    "SDK-US-001"
  ],
  "name": "continuation",
  "execution": {
    "mode": "live-selected-path",
    "reason": ""
  },
  "setup": {
    "files": {
      "numbers.txt": "7\n11\n"
    }
  },
  "inputs": {
    "input-1": "Reply with the word Ready.",
    "input-2": "Reply with the word Done."
  },
  "steps": [
    {
      "op": "session.open"
    },
    {
      "op": "input.submit",
      "input": "input-1"
    },
    {
      "op": "event.wait",
      "event": "execution.result",
      "onMissing": "untriggered"
    },
    {
      "op": "input.submit",
      "input": "input-2"
    },
    {
      "op": "event.wait",
      "event": "execution.result",
      "onMissing": "untriggered"
    },
    {
      "op": "session.close"
    }
  ],
  "expect": {
    "requests": [],
    "missingEvidence": "untriggered",
    "scope": "同一会话连续完成两次文本输入。",
    "caseId": "SDK-US-001/continuation",
    "outOfScope": [
      "重复拥有 Session",
      "媒体输入",
      "长期压力"
    ]
  },
  "limits": {
    "inputs": 2,
    "activitySeconds": 110,
    "transportSeconds": 120,
    "protocolBytes": 2097152,
    "stderrBytes": 262144
  }
}
