{
  "version": 2,
  "id": "SDK-US-015",
  "goals": [
    "SDK-US-015"
  ],
  "name": "cancellation",
  "execution": {
    "mode": "offline-only",
    "reason": "requires controlled protocol/storage evidence; ordinary model text cannot establish this branch"
  },
  "setup": {
    "files": {
      "numbers.txt": "7\n11\n"
    }
  },
  "inputs": {},
  "steps": [],
  "expect": {
    "requests": [],
    "missingEvidence": "untriggered",
    "scope": "离线取消一次本地等待并检查 Session 仍可继续。",
    "caseId": "SDK-US-015/cancellation",
    "outOfScope": [
      "停止远端任务",
      "真实 provider 重试行为"
    ]
  },
  "limits": {
    "inputs": 0,
    "activitySeconds": 110,
    "transportSeconds": 120,
    "protocolBytes": 2097152,
    "stderrBytes": 262144
  }
}
