{
  "version": 2,
  "id": "SDK-US-014",
  "goals": [
    "SDK-US-014"
  ],
  "name": "backpressure",
  "execution": {
    "mode": "offline-only",
    "reason": "requires controlled protocol/storage evidence; ordinary model text cannot establish this branch"
  },
  "setup": {
    "files": {
      "numbers.txt": "7\n11\n"
    }
  },
  "inputs": {},
  "steps": [],
  "expect": {
    "requests": [],
    "missingEvidence": "untriggered",
    "scope": "离线检查慢消费时已接收事件的交付和控制。",
    "caseId": "SDK-US-014/backpressure",
    "outOfScope": [
      "无界压力",
      "真实模型调度"
    ]
  },
  "limits": {
    "inputs": 0,
    "activitySeconds": 110,
    "transportSeconds": 120,
    "protocolBytes": 2097152,
    "stderrBytes": 262144
  }
}
