{
  "version": 2,
  "id": "SDK-US-002",
  "goals": [
    "SDK-US-002"
  ],
  "name": "structured-input",
  "execution": {
    "mode": "live-selected-path",
    "reason": ""
  },
  "setup": {
    "files": {
      "numbers.txt": "7\n11\n"
    }
  },
  "inputs": {
    "input-1": "Reply with the word Structured."
  },
  "steps": [
    {
      "op": "session.open"
    },
    {
      "op": "input.submit",
      "input": "input-1"
    },
    {
      "op": "event.wait",
      "event": "execution.result",
      "onMissing": "untriggered"
    },
    {
      "op": "session.close"
    }
  ],
  "expect": {
    "requests": [],
    "missingEvidence": "untriggered",
    "scope": "提交一次由原生适配器构造的文本输入并取得结果。",
    "caseId": "SDK-US-002/structured-input",
    "outOfScope": [
      "图片和文档输入",
      "混合媒体输入"
    ]
  },
  "limits": {
    "inputs": 1,
    "activitySeconds": 110,
    "transportSeconds": 120,
    "protocolBytes": 2097152,
    "stderrBytes": 262144
  }
}
