{
  "version": 2,
  "id": "SDK-US-008",
  "goals": [
    "SDK-US-008"
  ],
  "name": "stored-children",
  "execution": {
    "mode": "offline-only",
    "reason": "requires controlled protocol/storage evidence; ordinary model text cannot establish this branch"
  },
  "setup": {
    "files": {
      "numbers.txt": "7\n11\n"
    }
  },
  "inputs": {},
  "steps": [],
  "expect": {
    "requests": [],
    "missingEvidence": "untriggered",
    "scope": "从固定存储离线发现已有子任务。",
    "caseId": "SDK-US-008/stored-children",
    "outOfScope": [
      "恢复任务",
      "实时活跃状态",
      "新增模型调用"
    ]
  },
  "limits": {
    "inputs": 0,
    "activitySeconds": 110,
    "transportSeconds": 120,
    "protocolBytes": 2097152,
    "stderrBytes": 262144
  }
}
