{
  "version": 2,
  "id": "SDK-US-018",
  "goals": [
    "SDK-US-018"
  ],
  "name": "disconnect",
  "execution": {
    "mode": "offline-only",
    "reason": "requires controlled protocol/storage evidence; ordinary model text cannot establish this branch"
  },
  "setup": {
    "files": {
      "numbers.txt": "7\n11\n"
    }
  },
  "inputs": {},
  "steps": [],
  "expect": {
    "requests": [],
    "missingEvidence": "untriggered",
    "scope": "离线检查连接中断后的错误交付。",
    "caseId": "SDK-US-018/disconnect",
    "outOfScope": [
      "自动重连",
      "远端任务停止",
      "遗漏事件补齐"
    ]
  },
  "limits": {
    "inputs": 0,
    "activitySeconds": 110,
    "transportSeconds": 120,
    "protocolBytes": 2097152,
    "stderrBytes": 262144
  }
}
