{
  "version": 2,
  "id": "SDK-US-011",
  "goals": [
    "SDK-US-011"
  ],
  "name": "questions",
  "execution": {
    "mode": "live-selected-path",
    "reason": ""
  },
  "setup": {
    "files": {
      "numbers.txt": "7\n11\n"
    }
  },
  "inputs": {
    "input-1": "Ask which color to use, with choices Blue and Green. Wait for the answer, then finish briefly."
  },
  "steps": [
    {
      "op": "session.open"
    },
    {
      "op": "input.submit",
      "input": "input-1"
    },
    {
      "op": "event.wait",
      "event": "execution.result",
      "onMissing": "untriggered"
    },
    {
      "op": "session.close"
    }
  ],
  "expect": {
    "requests": [
      "question.answer"
    ],
    "missingEvidence": "untriggered",
    "scope": "回答一次固定选项的原生选择题，并观察任务结果。",
    "answers": {
      "question": "Which synthetic color?",
      "choice": "Blue",
      "options": [
        "Blue",
        "Green"
      ]
    },
    "caseId": "SDK-US-011/questions",
    "outOfScope": [
      "自由文本问题",
      "多题组合",
      "无效或重复回答"
    ]
  },
  "limits": {
    "inputs": 1,
    "activitySeconds": 110,
    "transportSeconds": 120,
    "protocolBytes": 2097152,
    "stderrBytes": 262144
  }
}
