{
  "version": 2,
  "id": "SDK-US-019",
  "goals": [
    "SDK-US-019"
  ],
  "name": "history",
  "execution": {
    "mode": "offline-only",
    "reason": "requires controlled protocol/storage evidence; ordinary model text cannot establish this branch"
  },
  "setup": {
    "files": {
      "numbers.txt": "7\n11\n"
    }
  },
  "inputs": {},
  "steps": [],
  "expect": {
    "requests": [],
    "missingEvidence": "untriggered",
    "scope": "离线发现固定保存的会话并读取 metadata 和内容。",
    "caseId": "SDK-US-019/history",
    "outOfScope": [
      "恢复或启动任务",
      "全部本机历史",
      "实时订阅"
    ]
  },
  "limits": {
    "inputs": 0,
    "activitySeconds": 110,
    "transportSeconds": 120,
    "protocolBytes": 2097152,
    "stderrBytes": 262144
  }
}
